{
  "schema_version": 1,
  "id": "gha-qwen17-validator-harness-crossover-v0",
  "decision_question": "If the OpenWorker/Qwen3-1.7B validator observation is valid, does changing only the admitted harness/tool realization materially change validator-role outcome for the same local Qwen3-1.7B model and public GHA CPU substrate?",
  "task": {
    "id": "candidate-contract-review-v0",
    "task_class": "validation.candidate-contract-review"
  },
  "actors": [
    "openworker-prebuilt-qwen3-1.7b-gha-ollama",
    "goose-prebuilt-qwen3-1.7b-gha-ollama",
    "codex-exec-prebuilt-qwen3-1.7b-gha-ollama"
  ],
  "replication": {
    "reps_per_actor": 1,
    "independent": true,
    "randomized_order": false
  },
  "frozen_factors": [
    "task package",
    "candidate cases",
    "Qwen3-1.7B model artifact",
    "Ubuntu 24.04 public GHA class",
    "independent deterministic verifier",
    "no cross-actor communication"
  ],
  "variable_under_test": "admitted harness/tool realization",
  "stop_conditions": [
    "OpenWorker baseline is not a valid observation",
    "harness fails before model inference",
    "task/verifier calibration failure",
    "unexpected authority expansion"
  ]
}
